{
  "$schema": "https://json-schema.org/draft/2020-12/schema",
  "$id": "mdoc-certificates-v1.schema.json",
  "title": "longfellow-vectors mdoc certificate vector, v1",
  "description": "Sidecar for a PEM certificate under vectors/mdoc/certificates/.",
  "type": "object",
  "properties": {
    "schema": { "const": "mdoc-certificates-v1.schema.json" },
    "role": {
      "enum": ["iaca", "document-signer"],
      "description": "Position in the ISO 18013-5 trust chain."
    },
    "sha256": {
      "$ref": "common-v1.schema.json#/$defs/sha256hex",
      "description": "SHA-256 of the sibling .pem file's bytes."
    },
    "public_key_x": {
      "$ref": "common-v1.schema.json#/$defs/p256coordinate",
      "description": "Affine coordinate x of the certificate's SubjectPublicKeyInfo P-256 key, lowercase hex. Omitted when the PEM does not parse or the key is not EC P-256."
    },
    "public_key_y": {
      "$ref": "common-v1.schema.json#/$defs/p256coordinate",
      "description": "Affine coordinate y of the certificate's SubjectPublicKeyInfo P-256 key, lowercase hex. Omitted when the PEM does not parse or the key is not EC P-256."
    },
    "signed_by": {
      "type": "string",
      "minLength": 1,
      "description": "Vector name of the certificate whose key signed this one. Present only when that signature verified at write time."
    },
    "key": {
      "type": "string",
      "minLength": 1,
      "description": "Vector name of the key vector this certificate certifies. Present only when the certificate's SubjectPublicKeyInfo matched that key vector at write time."
    },
    "provenance": { "$ref": "common-v1.schema.json#/$defs/provenance" },
    "comment": {
      "type": "string",
      "minLength": 1,
      "description": "Construction facts about the vector."
    }
  },
  "required": ["schema", "role", "sha256", "provenance"],
  "dependentRequired": {
    "public_key_x": ["public_key_y"],
    "public_key_y": ["public_key_x"]
  },
  "additionalProperties": false
}
