{
  "schema": "mdoc-certificates-v1.schema.json",
  "role": "document-signer",
  "sha256": "40caffb079b6e5380923bcd4f0565f4b80e1aaca45d13005f140d54cecd680fd",
  "signed_by": "root-ca",
  "provenance": {
    "type": "repository",
    "repo": "github.com/example/fixtures",
    "ref": "abababababababababababababababababababab",
    "path": "certificates/signer.pem"
  },
  "comment": "Document-signer certificate for the loader tests, carrying signed_by. public_key_x, public_key_y, and key are absent."
}
