{
  "schema": "mdoc-certificates-v1.schema.json",
  "role": "iaca",
  "sha256": "e3b0c44298fc1c149afbf4c8996fb92427ae41e4649b934ca495991b7852b855",
  "signed_by": "loop-b",
  "provenance": {
    "type": "constructed",
    "generator": "fixture"
  },
  "comment": "Certificate vector whose signed_by names loop-b, closing a signing cycle."
}
